{
  "schema_version": "understudy.executor-submit.v1",
  "experiment_id": "wl-or-orchestrator-repair",
  "candidate": {
    "candidate_id": "wl-or-dpo-b0.1-e3-r32",
    "executor": "fixture",
    "model": "nvidia/NVIDIA-Nemotron-3-Nano-30B-A3B-BF16",
    "model_revision": "BF16",
    "policy_ref": "experiments/workload-orchestrator/artifacts/dpo-train-receipt.json",
    "policy_sha256": "35f3686d09c194c77a517e238f606309f83e6dfcd0af8b8c2447df33f7d1e20b"
  },
  "attempt": 0,
  "workload": {
    "id": "wl-or-orchestrator-v1",
    "dataset_manifest_ref": "experiments/workload-orchestrator/artifacts/slice-gates.json",
    "dataset_manifest_sha256": "49e2f5615bf1b2614ed9a7ce5dc8f43fe4134c8a941b3d233b0f2275f6b0ab6d",
    "verifier_environment": "synthetic-workflow-shapes-offline (offline, outcome-first)",
    "verifier_revision": "30448f43a2c6d4487b2bfd94e408d31823874b193aa37263db1885936b4cf51f"
  },
  "splits": {
    "train_manifest_ref": "experiments/workload-orchestrator/slice.mjs#train@30448f43a2c6d4487b2bfd94e408d31823874b193aa37263db1885936b4cf51f",
    "dev_manifest_ref": "experiments/workload-orchestrator/slice.mjs#dev@026b432843e809da47f96df3e593d058e4b3f1994a40d895486812a48607edae"
  },
  "limits": {
    "budget_usd": 25,
    "max_concurrent_candidates": 1,
    "max_concurrent_requests_per_candidate": 10,
    "max_rollouts": 200,
    "max_runtime_seconds": 7200
  }
}
